Device: DEVICE ID 1d6b:0003 on Bus 002 Address 001 =================
 bLength                :   0x12 (18 bytes)
 bDescriptorType        :    0x1 Device
 bcdUSB                 :  0x310 USB 3.1
 bDeviceClass           :    0x9 Hub
 bDeviceSubClass        :    0x0
 bDeviceProtocol        :    0x3
 bMaxPacketSize0        :    0x9 (9 bytes)
 idVendor               : 0x1d6b
 idProduct              : 0x0003
 bcdDevice              :  0x601 Device 6.01
 iManufacturer          :    0x3 Error Accessing String
 iProduct               :    0x2 Error Accessing String
 iSerialNumber          :    0x1 Error Accessing String
 bNumConfigurations     :    0x1
  CONFIGURATION 1: 0 mA ====================================
   bLength              :    0x9 (9 bytes)
   bDescriptorType      :    0x2 Configuration
   wTotalLength         :   0x1f (31 bytes)
   bNumInterfaces       :    0x1
   bConfigurationValue  :    0x1
   iConfiguration       :    0x0 
   bmAttributes         :   0xe0 Self Powered, Remote Wakeup
   bMaxPower            :    0x0 (0 mA)
    INTERFACE 0: Hub =======================================
     bLength            :    0x9 (9 bytes)
     bDescriptorType    :    0x4 Interface
     bInterfaceNumber   :    0x0
     bAlternateSetting  :    0x0
     bNumEndpoints      :    0x1
     bInterfaceClass    :    0x9 Hub
     bInterfaceSubClass :    0x0
     bInterfaceProtocol :    0x0
     iInterface         :    0x0 
      ENDPOINT 0x81: Interrupt IN ==========================
       bLength          :    0x7 (7 bytes)
       bDescriptorType  :    0x5 Endpoint
       bEndpointAddress :   0x81 IN
       bmAttributes     :    0x3 Interrupt
       wMaxPacketSize   :    0x4 (4 bytes)
       bInterval        :    0xc
Vendor ID: 0x1d6b
Product ID: 0x3
Device: DEVICE ID 30fa:0302 on Bus 001 Address 006 =================
 bLength                :   0x12 (18 bytes)
 bDescriptorType        :    0x1 Device
 bcdUSB                 :  0x110 USB 1.1
 bDeviceClass           :    0x0 Specified at interface
 bDeviceSubClass        :    0x0
 bDeviceProtocol        :    0x0
 bMaxPacketSize0        :    0x8 (8 bytes)
 idVendor               : 0x30fa
 idProduct              : 0x0302
 bcdDevice              :  0x100 Device 1.0
 iManufacturer          :    0x1 Error Accessing String
 iProduct               :    0x2 Error Accessing String
 iSerialNumber          :    0x0 
 bNumConfigurations     :    0x1
  CONFIGURATION 1: 100 mA ==================================
   bLength              :    0x9 (9 bytes)
   bDescriptorType      :    0x2 Configuration
   wTotalLength         :   0x22 (34 bytes)
   bNumInterfaces       :    0x1
   bConfigurationValue  :    0x1
   iConfiguration       :    0x0 
   bmAttributes         :   0xa0 Bus Powered, Remote Wakeup
   bMaxPower            :   0x32 (100 mA)
    INTERFACE 0: Human Interface Device ====================
     bLength            :    0x9 (9 bytes)
     bDescriptorType    :    0x4 Interface
     bInterfaceNumber   :    0x0
     bAlternateSetting  :    0x0
     bNumEndpoints      :    0x1
     bInterfaceClass    :    0x3 Human Interface Device
     bInterfaceSubClass :    0x1
     bInterfaceProtocol :    0x2
     iInterface         :    0x0 
      ENDPOINT 0x81: Interrupt IN ==========================
       bLength          :    0x7 (7 bytes)
       bDescriptorType  :    0x5 Endpoint
       bEndpointAddress :   0x81 IN
       bmAttributes     :    0x3 Interrupt
       wMaxPacketSize   :    0x5 (5 bytes)
       bInterval        :    0xa
Vendor ID: 0x30fa
Product ID: 0x302
Device: DEVICE ID 1a2c:4094 on Bus 001 Address 005 =================
 bLength                :   0x12 (18 bytes)
 bDescriptorType        :    0x1 Device
 bcdUSB                 :  0x110 USB 1.1
 bDeviceClass           :    0x0 Specified at interface
 bDeviceSubClass        :    0x0
 bDeviceProtocol        :    0x0
 bMaxPacketSize0        :    0x8 (8 bytes)
 idVendor               : 0x1a2c
 idProduct              : 0x4094
 bcdDevice              :  0x110 Device 1.1
 iManufacturer          :    0x1 Error Accessing String
 iProduct               :    0x2 Error Accessing String
 iSerialNumber          :    0x0 
 bNumConfigurations     :    0x1
  CONFIGURATION 1: 500 mA ==================================
   bLength              :    0x9 (9 bytes)
   bDescriptorType      :    0x2 Configuration
   wTotalLength         :   0x3b (59 bytes)
   bNumInterfaces       :    0x2
   bConfigurationValue  :    0x1
   iConfiguration       :    0x0 
   bmAttributes         :   0xa0 Bus Powered, Remote Wakeup
   bMaxPower            :   0xfa (500 mA)
    INTERFACE 0: Human Interface Device ====================
     bLength            :    0x9 (9 bytes)
     bDescriptorType    :    0x4 Interface
     bInterfaceNumber   :    0x0
     bAlternateSetting  :    0x0
     bNumEndpoints      :    0x1
     bInterfaceClass    :    0x3 Human Interface Device
     bInterfaceSubClass :    0x1
     bInterfaceProtocol :    0x1
     iInterface         :    0x0 
      ENDPOINT 0x81: Interrupt IN ==========================
       bLength          :    0x7 (7 bytes)
       bDescriptorType  :    0x5 Endpoint
       bEndpointAddress :   0x81 IN
       bmAttributes     :    0x3 Interrupt
       wMaxPacketSize   :    0x8 (8 bytes)
       bInterval        :    0xa
    INTERFACE 1: Human Interface Device ====================
     bLength            :    0x9 (9 bytes)
     bDescriptorType    :    0x4 Interface
     bInterfaceNumber   :    0x1
     bAlternateSetting  :    0x0
     bNumEndpoints      :    0x1
     bInterfaceClass    :    0x3 Human Interface Device
     bInterfaceSubClass :    0x0
     bInterfaceProtocol :    0x0
     iInterface         :    0x0 
      ENDPOINT 0x82: Interrupt IN ==========================
       bLength          :    0x7 (7 bytes)
       bDescriptorType  :    0x5 Endpoint
       bEndpointAddress :   0x82 IN
       bmAttributes     :    0x3 Interrupt
       wMaxPacketSize   :    0x3 (3 bytes)
       bInterval        :    0xa
Vendor ID: 0x1a2c
Product ID: 0x4094
Device: DEVICE ID 14cd:8601 on Bus 001 Address 004 =================
 bLength                :   0x12 (18 bytes)
 bDescriptorType        :    0x1 Device
 bcdUSB                 :  0x200 USB 2.0
 bDeviceClass           :    0x9 Hub
 bDeviceSubClass        :    0x0
 bDeviceProtocol        :    0x1
 bMaxPacketSize0        :   0x40 (64 bytes)
 idVendor               : 0x14cd
 idProduct              : 0x8601
 bcdDevice              :    0x0 Device 0.0
 iManufacturer          :    0x1 Error Accessing String
 iProduct               :    0x3 Error Accessing String
 iSerialNumber          :    0x0 
 bNumConfigurations     :    0x1
  CONFIGURATION 1: 100 mA ==================================
   bLength              :    0x9 (9 bytes)
   bDescriptorType      :    0x2 Configuration
   wTotalLength         :   0x19 (25 bytes)
   bNumInterfaces       :    0x1
   bConfigurationValue  :    0x1
   iConfiguration       :    0x0 
   bmAttributes         :   0xe0 Self Powered, Remote Wakeup
   bMaxPower            :   0x32 (100 mA)
    INTERFACE 0: Hub =======================================
     bLength            :    0x9 (9 bytes)
     bDescriptorType    :    0x4 Interface
     bInterfaceNumber   :    0x0
     bAlternateSetting  :    0x0
     bNumEndpoints      :    0x1
     bInterfaceClass    :    0x9 Hub
     bInterfaceSubClass :    0x0
     bInterfaceProtocol :    0x0
     iInterface         :    0x0 
      ENDPOINT 0x81: Interrupt IN ==========================
       bLength          :    0x7 (7 bytes)
       bDescriptorType  :    0x5 Endpoint
       bEndpointAddress :   0x81 IN
       bmAttributes     :    0x3 Interrupt
       wMaxPacketSize   :    0x1 (1 bytes)
       bInterval        :    0xc
Vendor ID: 0x14cd
Product ID: 0x8601
Device: DEVICE ID 05e3:0608 on Bus 001 Address 003 =================
 bLength                :   0x12 (18 bytes)
 bDescriptorType        :    0x1 Device
 bcdUSB                 :  0x200 USB 2.0
 bDeviceClass           :    0x9 Hub
 bDeviceSubClass        :    0x0
 bDeviceProtocol        :    0x1
 bMaxPacketSize0        :   0x40 (64 bytes)
 idVendor               : 0x05e3
 idProduct              : 0x0608
 bcdDevice              : 0x6070 Device 96.7
 iManufacturer          :    0x0 
 iProduct               :    0x1 Error Accessing String
 iSerialNumber          :    0x0 
 bNumConfigurations     :    0x1
  CONFIGURATION 1: 100 mA ==================================
   bLength              :    0x9 (9 bytes)
   bDescriptorType      :    0x2 Configuration
   wTotalLength         :   0x19 (25 bytes)
   bNumInterfaces       :    0x1
   bConfigurationValue  :    0x1
   iConfiguration       :    0x0 
   bmAttributes         :   0xe0 Self Powered, Remote Wakeup
   bMaxPower            :   0x32 (100 mA)
    INTERFACE 0: Hub =======================================
     bLength            :    0x9 (9 bytes)
     bDescriptorType    :    0x4 Interface
     bInterfaceNumber   :    0x0
     bAlternateSetting  :    0x0
     bNumEndpoints      :    0x1
     bInterfaceClass    :    0x9 Hub
     bInterfaceSubClass :    0x0
     bInterfaceProtocol :    0x0
     iInterface         :    0x0 
      ENDPOINT 0x81: Interrupt IN ==========================
       bLength          :    0x7 (7 bytes)
       bDescriptorType  :    0x5 Endpoint
       bEndpointAddress :   0x81 IN
       bmAttributes     :    0x3 Interrupt
       wMaxPacketSize   :    0x1 (1 bytes)
       bInterval        :    0xc
Vendor ID: 0x5e3
Product ID: 0x608
Device: DEVICE ID 1d6b:0002 on Bus 001 Address 001 =================
 bLength                :   0x12 (18 bytes)
 bDescriptorType        :    0x1 Device
 bcdUSB                 :  0x200 USB 2.0
 bDeviceClass           :    0x9 Hub
 bDeviceSubClass        :    0x0
 bDeviceProtocol        :    0x1
 bMaxPacketSize0        :   0x40 (64 bytes)
 idVendor               : 0x1d6b
 idProduct              : 0x0002
 bcdDevice              :  0x601 Device 6.01
 iManufacturer          :    0x3 Error Accessing String
 iProduct               :    0x2 Error Accessing String
 iSerialNumber          :    0x1 Error Accessing String
 bNumConfigurations     :    0x1
  CONFIGURATION 1: 0 mA ====================================
   bLength              :    0x9 (9 bytes)
   bDescriptorType      :    0x2 Configuration
   wTotalLength         :   0x19 (25 bytes)
   bNumInterfaces       :    0x1
   bConfigurationValue  :    0x1
   iConfiguration       :    0x0 
   bmAttributes         :   0xe0 Self Powered, Remote Wakeup
   bMaxPower            :    0x0 (0 mA)
    INTERFACE 0: Hub =======================================
     bLength            :    0x9 (9 bytes)
     bDescriptorType    :    0x4 Interface
     bInterfaceNumber   :    0x0
     bAlternateSetting  :    0x0
     bNumEndpoints      :    0x1
     bInterfaceClass    :    0x9 Hub
     bInterfaceSubClass :    0x0
     bInterfaceProtocol :    0x0
     iInterface         :    0x0 
      ENDPOINT 0x81: Interrupt IN ==========================
       bLength          :    0x7 (7 bytes)
       bDescriptorType  :    0x5 Endpoint
       bEndpointAddress :   0x81 IN
       bmAttributes     :    0x3 Interrupt
       wMaxPacketSize   :    0x4 (4 bytes)
       bInterval        :    0xc
Vendor ID: 0x1d6b
Product ID: 0x2
